{
  "corpus_version": "0.1-seed",
  "collected_on": "2026-08-28",
  "purpose": "Discover candidate advisor-question themes and discipline-conditioned evidence needs for future evaluation design.",
  "claim_boundary": "These public retrospective reports are unpaired discovery material. They are not consented pilot cases, not representative prevalence data, and not evidence that the skill predicts an individual advisor.",
  "evidence_tiers": {
    "B": "A first-person public retrospective that reports a concrete advisor, supervisor, or lab-meeting question or feedback event.",
    "C": "A first-person or close-observer public retrospective that reports a recurring meeting pattern but not a sufficiently specific question event.",
    "D": "Community guidance or a public norm statement that may suggest a theme but is not an observed advisor-question event."
  },
  "records": [
    {
      "id": "PQ001",
      "source_id": "SRC001",
      "source_fingerprint": "sha256:98c85b59c699a295bccf171649bd908f16db7befe1e769c4596bcad65005a530",
      "platform": "dcard",
      "access_method": "public-search-index",
      "evidence_tier": "B",
      "author_stage": "masters",
      "discipline": {"broad_group": "computing-engineering", "label": "computer science", "basis": "self-reported"},
      "meeting_type": "advisor-meeting",
      "observation_type": "actual-question",
      "paraphrase": "The advisor repeatedly asked why the student was not seen in the laboratory even though the computing work could be done remotely.",
      "mapped_theme_ids": [],
      "candidate_theme_ids": ["research-process-visibility"],
      "paired_pre_meeting_material": false,
      "privacy": {"username_stored": false, "direct_quote_stored": false, "sensitive_detail_excluded": true}
    },
    {
      "id": "PQ002",
      "source_id": "SRC002",
      "source_fingerprint": "sha256:af5b9a8db40e56ff14d6675c00d09fc60ae1796315f5d0016cc42eb6daa8734a",
      "platform": "dcard",
      "access_method": "public-search-index",
      "evidence_tier": "B",
      "author_stage": "masters",
      "discipline": {"broad_group": "unknown", "label": "science field", "basis": "self-reported"},
      "meeting_type": "advisor-meeting",
      "observation_type": "reported-feedback",
      "paraphrase": "After the student presented experiments with little visible outcome, the advisor challenged whether that was the full extent of the progress.",
      "mapped_theme_ids": [],
      "candidate_theme_ids": ["progress-adequacy"],
      "paired_pre_meeting_material": false,
      "privacy": {"username_stored": false, "direct_quote_stored": false, "sensitive_detail_excluded": true}
    },
    {
      "id": "PQ003",
      "source_id": "SRC003",
      "source_fingerprint": "sha256:c30f3188fd070223e0c5ea7d83e0a6cdc5a1052fa74e896e6e8baf6a54fec1a0",
      "platform": "dcard",
      "access_method": "public-search-index",
      "evidence_tier": "C",
      "author_stage": "masters",
      "discipline": {"broad_group": "computing-engineering", "label": "computer vision", "basis": "self-reported"},
      "meeting_type": "lab-meeting",
      "observation_type": "reported-pattern",
      "paraphrase": "Meeting direction reportedly shifted among several new model families before the students could finish learning or implementing the preceding one.",
      "mapped_theme_ids": ["incomplete-prior-action"],
      "candidate_theme_ids": ["direction-stability"],
      "paired_pre_meeting_material": false,
      "privacy": {"username_stored": false, "direct_quote_stored": false, "sensitive_detail_excluded": true}
    },
    {
      "id": "PQ004",
      "source_id": "SRC004",
      "source_fingerprint": "sha256:31242edd4d86b249ffef9acbc61e7ee327598eb399b4a8ec6f7b87241246782e",
      "platform": "reddit",
      "access_method": "public-search-index",
      "evidence_tier": "B",
      "author_stage": "unknown",
      "discipline": {"broad_group": "life-health", "label": "drug discovery", "basis": "self-reported"},
      "meeting_type": "advisor-meeting",
      "observation_type": "actual-question",
      "paraphrase": "During a project update, the principal investigator asked for the scientific reason the studied drug had originally been developed.",
      "mapped_theme_ids": [],
      "candidate_theme_ids": ["project-origin-rationale"],
      "paired_pre_meeting_material": false,
      "privacy": {"username_stored": false, "direct_quote_stored": false, "sensitive_detail_excluded": true}
    },
    {
      "id": "PQ005",
      "source_id": "SRC005",
      "source_fingerprint": "sha256:64f3c38641eb57d0ed9b01e677d37c3d47c0c4cf9f11607a33d1d429dcd4086d",
      "platform": "reddit",
      "access_method": "public-search-index",
      "evidence_tier": "B",
      "author_stage": "unknown",
      "discipline": {"broad_group": "unknown", "label": "STEM field", "basis": "post-context"},
      "meeting_type": "advisor-meeting",
      "observation_type": "actual-question",
      "paraphrase": "A supervisor challenged the rationale for using a field-standard convention rather than accepting convention alone as justification.",
      "mapped_theme_ids": [],
      "candidate_theme_ids": ["method-choice-rationale"],
      "paired_pre_meeting_material": false,
      "privacy": {"username_stored": false, "direct_quote_stored": false, "sensitive_detail_excluded": true}
    },
    {
      "id": "PQ006",
      "source_id": "SRC005",
      "source_fingerprint": "sha256:64f3c38641eb57d0ed9b01e677d37c3d47c0c4cf9f11607a33d1d429dcd4086d",
      "platform": "reddit",
      "access_method": "public-search-index",
      "evidence_tier": "B",
      "author_stage": "unknown",
      "discipline": {"broad_group": "life-health", "label": "experimental life science", "basis": "post-context"},
      "meeting_type": "advisor-meeting",
      "observation_type": "actual-question",
      "paraphrase": "A principal investigator asked why a specific experimental time point had been selected, exposing the need to justify design parameters scientifically.",
      "mapped_theme_ids": [],
      "candidate_theme_ids": ["parameter-choice-rationale"],
      "paired_pre_meeting_material": false,
      "privacy": {"username_stored": false, "direct_quote_stored": false, "sensitive_detail_excluded": true}
    },
    {
      "id": "PQ007",
      "source_id": "SRC006",
      "source_fingerprint": "sha256:7c671df5fc30d30306826a3f1d6ae3fd68393f59b7bb4edb15737fc2d35bfd33",
      "platform": "reddit",
      "access_method": "public-search-index",
      "evidence_tier": "B",
      "author_stage": "undergraduate",
      "discipline": {"broad_group": "life-health", "label": "biomarker wet lab", "basis": "post-context"},
      "meeting_type": "lab-meeting",
      "observation_type": "actual-question",
      "paraphrase": "In a lab presentation, the supervisor pressed the presenter to justify both a selected concentration and the choice of primer.",
      "mapped_theme_ids": [],
      "candidate_theme_ids": ["parameter-choice-rationale"],
      "paired_pre_meeting_material": false,
      "privacy": {"username_stored": false, "direct_quote_stored": false, "sensitive_detail_excluded": true}
    },
    {
      "id": "PQ008",
      "source_id": "SRC007",
      "source_fingerprint": "sha256:00ac55a949a44456eb2d843ac1d9a4f7a68223414a1298c781dd237e4928f88a",
      "platform": "reddit",
      "access_method": "public-search-index",
      "evidence_tier": "B",
      "author_stage": "doctoral",
      "discipline": {"broad_group": "social-humanities", "label": "case-study research", "basis": "post-context"},
      "meeting_type": "supervision-meeting",
      "observation_type": "actual-question",
      "paraphrase": "A supervisor asked how the dissertation sample size had been derived when the student had treated the selected organizations as the full case set.",
      "mapped_theme_ids": ["insufficient-replication"],
      "candidate_theme_ids": ["sampling-frame-justification"],
      "paired_pre_meeting_material": false,
      "privacy": {"username_stored": false, "direct_quote_stored": false, "sensitive_detail_excluded": true}
    },
    {
      "id": "PQ009",
      "source_id": "SRC008",
      "source_fingerprint": "sha256:aa4de458173a15128f03bbf858cc333b45205836e59719a0559029fb3b268ae6",
      "platform": "reddit",
      "access_method": "public-search-index",
      "evidence_tier": "B",
      "author_stage": "doctoral",
      "discipline": {"broad_group": "life-health", "label": "clinical or health research", "basis": "post-context"},
      "meeting_type": "lab-meeting",
      "observation_type": "reported-feedback",
      "paraphrase": "With a very small control group and an unsatisfactory correlation, the supervisor requested interpretation and questioned whether measurement problems could explain the result.",
      "mapped_theme_ids": ["insufficient-replication", "alternative-causal-explanation"],
      "candidate_theme_ids": ["measurement-validity"],
      "paired_pre_meeting_material": false,
      "privacy": {"username_stored": false, "direct_quote_stored": false, "sensitive_detail_excluded": true}
    },
    {
      "id": "PQ010",
      "source_id": "SRC009",
      "source_fingerprint": "sha256:8c3c23de0d278ade4a3226562e2699ddb94a9e25f81a605197d5cb197583c7ef",
      "platform": "reddit",
      "access_method": "public-search-index",
      "evidence_tier": "B",
      "author_stage": "doctoral",
      "discipline": {"broad_group": "computing-engineering", "label": "prototype-based research", "basis": "post-context"},
      "meeting_type": "advisor-meeting",
      "observation_type": "actual-question",
      "paraphrase": "After a prototype appeared promising, the advisor challenged whether the student had produced the solution and asked where the solution had originated.",
      "mapped_theme_ids": [],
      "candidate_theme_ids": ["solution-provenance"],
      "paired_pre_meeting_material": false,